{
  "schema_version":"1.0","registry_version":"0.1.0",
  "profiles":[
    {"id":"documents-ocr","modality":"document","framework":"Docling","revision":"2.123.1 observed 2026-08-29","licence":"MIT candidate; verify transitive OCR assets","status":"assessed_not_installed","governance":"conditional","privacy":{"network":"disabled until admitted","telemetry":"none permitted","cache":"local selected privacy mode","remote_code":"prohibited"},"limits":{"inputs":"born-digital, scanned, rotated, low-quality, multilingual, handwritten and hostile synthetic descriptors","outputs":"text, layout, tables, reading order, page and region provenance","failure_modes":["OCR error","lost reading order","hostile parser input"],"device_classes":["macos-local","windows-cpu","ci-contract"]},"lifecycle":{"install":"agent-assisted profile after preflight","discover":"import and exact-version probe","health_check":"synthetic coordinate fixture","rollback":"disable profile and retain source","uninstall":"remove optional environment and cache","replacement":"adapter contract remains framework-neutral"}},
    {"id":"encoders-local","modality":"encoder","framework":"Transformers 5.16.1 / ONNX Runtime 1.29.0 / OpenVINO 2026.3.1","revision":"observed 2026-08-29","licence":"Apache-2.0 / MIT; model licence separately required","status":"assessed_not_installed","governance":"conditional","privacy":{"network":"disabled until admitted","telemetry":"none permitted","cache":"local compartment only","remote_code":"prohibited"},"limits":{"inputs":"bounded synthetic text descriptors","outputs":"embedding, score or label with truncation metadata","failure_modes":["truncation","domain drift","miscalibration","quantisation drift"],"device_classes":["macos-local","windows-cpu","ci-contract"]},"lifecycle":{"install":"separate optional backend profile","discover":"backend and model revision probe","health_check":"synthetic truncation fixture","rollback":"disable adapter","uninstall":"remove backend and model cache","replacement":"exchange backend behind contract"}},
    {"id":"speech-local","modality":"speech","framework":"faster-whisper / whisper.cpp / optional pyannote","revision":"faster-whisper 1.2.1 and pyannote-audio 4.0.7 observed 2026-08-29","licence":"MIT candidates; model and diarisation terms separately required","status":"assessed_not_installed","governance":"conditional","privacy":{"network":"disabled until admitted","telemetry":"none permitted","cache":"audio and features remain in selected compartment","remote_code":"prohibited"},"limits":{"inputs":"synthetic timestamped audio descriptors","outputs":"transcript spans and uncertain speaker labels","failure_modes":["hallucination","overlap","accent or terminology error","speaker uncertainty"],"device_classes":["macos-local","windows-cpu","ci-contract"]},"lifecycle":{"install":"separate transcription and diarisation profiles","discover":"binary/package and model probe","health_check":"synthetic timestamp fixture","rollback":"disable diarisation then transcription","uninstall":"remove binaries models and cache","replacement":"timestamp contract survives backend replacement"}},
    {"id":"medical-imaging-research","modality":"image","framework":"pydicom / Orthanc-compatible / MONAI","revision":"pydicom 3.0.2 and MONAI 1.6.0 observed 2026-08-29","licence":"MIT/Apache-2.0 candidates; Orthanc plugin terms separately reviewed","status":"contract_only","governance":"research_disabled","privacy":{"network":"disabled","telemetry":"none","cache":"local research compartment","remote_code":"prohibited"},"limits":{"inputs":"synthetic DICOM metadata and pixel-region descriptors only","outputs":"metadata, series integrity and provenance; no interpretation","failure_modes":["burned-in identifier","UID leakage","series mismatch","adversarial file"],"device_classes":["ci-contract"]},"lifecycle":{"install":"not installable while research-disabled","discover":"explicit unsupported state","health_check":"synthetic de-identification fixture","rollback":"disable and quarantine derivatives","uninstall":"remove optional research environment","replacement":"DICOM contract remains standards-compatible"}},
    {"id":"ecg-research","modality":"signal","framework":"WFDB","revision":"4.3.1 observed 2026-08-29","licence":"MIT","status":"contract_only","governance":"research_disabled","privacy":{"network":"disabled","telemetry":"none","cache":"local research compartment","remote_code":"prohibited"},"limits":{"inputs":"synthetic lead and sampling descriptors","outputs":"segments, annotations and provenance; no diagnosis","failure_modes":["missing lead","noise","resampling drift","device variation"],"device_classes":["ci-contract"]},"lifecycle":{"install":"not installable while research-disabled","discover":"explicit unsupported state","health_check":"synthetic timestamp fixture","rollback":"disable inference path","uninstall":"remove optional research environment","replacement":"WFDB-compatible contract retained"}}
  ],
  "fixtures":[
    {"id":"doc-coordinate","profile_id":"documents-ocr","synthetic":true,"input":{"page":1,"region":[10,20,110,60],"rotation":90,"quality":"low"},"expected_provenance":[{"page":1,"region":[10,20,110,60],"confidence":0.7}],"interpretation_allowed":false},
    {"id":"encoder-truncation","profile_id":"encoders-local","synthetic":true,"input":{"characters":9000,"declared_limit":4096},"expected_provenance":[{"truncated":true,"input_characters":9000}],"interpretation_allowed":false},
    {"id":"speech-timestamp","profile_id":"speech-local","synthetic":true,"input":{"duration_ms":3000,"overlap":true},"expected_provenance":[{"start_ms":0,"end_ms":3000,"speaker":"uncertain"}],"interpretation_allowed":false},
    {"id":"dicom-research-disabled","profile_id":"medical-imaging-research","synthetic":true,"input":{"series_instances":2,"burned_in_annotation":"YES"},"expected_provenance":[{"series_instances":2,"quarantine":true}],"interpretation_allowed":false},
    {"id":"ecg-research-disabled","profile_id":"ecg-research","synthetic":true,"input":{"leads":["I","II"],"sampling_hz":250,"duration_s":10},"expected_provenance":[{"samples":2500,"missing_leads":true}],"interpretation_allowed":false}
  ]
}
